{
  "$schema": "./estimate-ledger.schema.json",
  "schemaVersion": 1,
  "ledgerId": "P0.ESTIMATE.UNIQUE_BUCKET_RECONCILIATION",
  "asOfCommit": "42ec333848e29e97c41699b9fed73ed199740e3f",
  "targetHeadCommit": "1587615c751c3cb12b5078ab4b7264b6e9fd42ad",
  "provenance": {
    "sourceSnapshot": {
      "commitField": "asOfCommit",
      "classification": "source_snapshot"
    },
    "targetSnapshot": {
      "commitField": "targetHeadCommit",
      "classification": "target_candidate"
    },
    "headPolicy": "pinned_snapshots_no_head_equality",
    "ancestryPolicy": "source_snapshot_must_be_ancestor_of_target_candidate",
    "authority": {
      "artifactStatus": "current_candidate_not_canonical",
      "reviewDisposition": "pending",
      "canonicalEntrypoint": "docs/hosted-web-phases/START_HERE.md",
      "evidenceLifecycle": "docs/hosted-web-phases/EVIDENCE_LIFECYCLE.md",
      "supersededRejectedArtifact": "estimate-candidate-reconcile-h4"
    }
  },
  "status": "current_candidate_requires_scope_design_review",
  "unit": "gross_integrated_changed_lines",
  "accountingPolicy": {
    "definition": "Additions plus deletions in the final integrated non-terminal v1 diff. A line is counted once after integration, matching the parent plan's definition even though that plan calls the measure net changed lines.",
    "endpointRule": "Normalize every lane endpoint as production additions plus test/evidence additions plus deleted legacy lines at the same low or high endpoint. Never subtract deletions.",
    "deletionRule": "Deleted legacy lines are a positive changed-line component, not negative implementation. Migration and rollout are tracked as scope and are not inferred from deletion counts.",
    "deduplicationRule": "Each semantic allocation has exactly one numeric disposition and one bucket owner. Source envelopes are decomposed into unique and explicitly excluded shared allocations; numeric endpoint containment is never evidence of semantic containment. Cross-feature release evidence includes only production-shape work not already owned by a feature bucket.",
    "excluded": [
      "generated bundles and manifests",
      "lockfile and vendor churn",
      "mechanical formatting",
      "Phase 0 research artifact lines",
      "post-v1 hosted terminal implementation and packaging"
    ]
  },
  "sources": [
    {
      "sourceId": "PARENT_PLAN",
      "path": "docs/hosted-web-e2e-completion-plan.md",
      "sha256": "4901a37dc4da373efab939b43a406739ed02e1b4e250a7a2e5754ad659fa4080",
      "role": "parent_plan",
      "provenanceClass": "source_snapshot"
    },
    {
      "sourceId": "P0.BASELINE_ESTIMATE",
      "path": "docs/research/hosted-web/phase-0/estimate-ledger.md",
      "sha256": "1b0f45bfdeb17e2ddc6058482c9b190f16b09501561c361370fac5bfad783ab0",
      "role": "baseline",
      "provenanceClass": "source_snapshot"
    },
    {
      "sourceId": "P0.FREEZE_EVIDENCE_INDEX",
      "path": "docs/research/hosted-web/phase-0/freeze/current-canonical/evidence-index.json",
      "sha256": "d5c8725dfb22f7e0228e0dd51f53d978d117ed7253fdb279c8ddba7000ff8758",
      "role": "freeze_index",
      "provenanceClass": "source_snapshot"
    },
    {
      "sourceId": "P0.W1.ESTIMATE",
      "path": "docs/research/hosted-web/phase-0/parity-renderer/estimate-input.json",
      "sha256": "af3fe8edc17ac5f3ca77533a949625b5b97c61c3ebab111726f72ebdc9adf669",
      "role": "lane_estimate",
      "provenanceClass": "source_snapshot"
    },
    {
      "sourceId": "P0.W2.ESTIMATE",
      "path": "docs/research/hosted-web/phase-0/provider-runtime/estimate-input.json",
      "sha256": "6316c642472506f51638673aa3ede535dc358264c77b4cff43ca83364d879625",
      "role": "lane_estimate",
      "provenanceClass": "source_snapshot"
    },
    {
      "sourceId": "P0.W3.ESTIMATE",
      "path": "docs/research/hosted-web/phase-0/state-writers/estimate-input.json",
      "sha256": "e115aa10ab1ad3842e8b44db03a07541cae9b6abdbeb1207ba3f01bd6d5ff7ae",
      "role": "lane_estimate",
      "provenanceClass": "source_snapshot"
    },
    {
      "sourceId": "P0.W4.ESTIMATE",
      "path": "docs/research/hosted-web/phase-0/host-primitives/estimate-input.json",
      "sha256": "a1b527c3f9ecd1863223eed43bc6e0a3ea720af9138114b9924d0e8acf062f7c",
      "role": "lane_estimate",
      "provenanceClass": "source_snapshot"
    },
    {
      "sourceId": "P0.W5.ESTIMATE",
      "path": "docs/research/hosted-web/phase-0/recovery-events/estimate-input.json",
      "sha256": "03f41142c1845f913bd0dfbd59499cfb6390454c36f4fec596432e7faf714341",
      "role": "lane_estimate",
      "provenanceClass": "source_snapshot"
    },
    {
      "sourceId": "P0.W6.ESTIMATE",
      "path": "docs/research/hosted-web/phase-0/auth-artifacts/estimate-input.json",
      "sha256": "1309dd32d3ebf57447dc181b802fa5e625f1b7bb069fc040c08fef74513750b8",
      "role": "lane_estimate",
      "provenanceClass": "source_snapshot"
    },
    {
      "sourceId": "P0.W1.ACTION_INVENTORY",
      "path": "docs/research/hosted-web/phase-0/parity-renderer/renderer-action-inventory.json",
      "sha256": "9ff8164fb83dd235b69aef81168d03ed5c6dd84f5ffd25fab25bacd594d175b4",
      "role": "supporting_evidence",
      "provenanceClass": "source_snapshot"
    },
    {
      "sourceId": "P0.W1.API_PARITY",
      "path": "docs/research/hosted-web/phase-0/parity-renderer/api-parity-ledger.json",
      "sha256": "a11f469d9c981c3e05be57fed7a6303772349a79297a0f1887db97d54e84c0a3",
      "role": "supporting_evidence",
      "provenanceClass": "source_snapshot"
    },
    {
      "sourceId": "P0.W2.EXECUTION_TOPOLOGY",
      "path": "docs/research/hosted-web/phase-0/provider-runtime/execution-topology.json",
      "sha256": "40650b7ec3549a30419932fa43330b1484468c393ddef0555438f9f308c97e3a",
      "role": "supporting_evidence",
      "provenanceClass": "source_snapshot"
    },
    {
      "sourceId": "P0.W2.RUNTIME_INGRESS",
      "path": "docs/research/hosted-web/phase-0/provider-runtime/runtime-ingress-inventory.json",
      "sha256": "531ae8746d48e527c4e1a857e8b6077c5c9d58cf1ca0ca6523cd629a98c0e807",
      "role": "supporting_evidence",
      "provenanceClass": "source_snapshot"
    },
    {
      "sourceId": "P0.W3.STATE_FAMILIES",
      "path": "docs/research/hosted-web/phase-0/state-writers/state-family-catalog.json",
      "sha256": "f987dfb942445d3ac9ebfeb1a4f931291b7b834af45e5979d45518d59975e90a",
      "role": "supporting_evidence",
      "provenanceClass": "source_snapshot"
    },
    {
      "sourceId": "P0.W3.WRITER_COORDINATION",
      "path": "docs/research/hosted-web/phase-0/state-writers/writer-coordination.json",
      "sha256": "7c7c572e068b04c9b84886d2a7c47aa3e04ba714311b2f8c98b0fe066c7d52ef",
      "role": "supporting_evidence",
      "provenanceClass": "source_snapshot"
    },
    {
      "sourceId": "P0.W3.BACKUP_BEHAVIOR",
      "path": "docs/research/hosted-web/phase-0/state-writers/backup-behavior.json",
      "sha256": "a9cff35be387062de2ce908a98aa0613cf460bd43cb5e1b3eeeb7d1c704f0623",
      "role": "supporting_evidence",
      "provenanceClass": "source_snapshot"
    },
    {
      "sourceId": "P0.W4.HOST_PROBES",
      "path": "docs/research/hosted-web/phase-0/host-primitives/current-host-probe-results.json",
      "sha256": "4eca557b6f457e4da93fd5a7fcb1603d63d77f007a9f51101302b177e3a40378",
      "role": "supporting_evidence",
      "provenanceClass": "source_snapshot"
    },
    {
      "sourceId": "P0.W4.NATIVE_ARTIFACT",
      "path": "docs/research/hosted-web/phase-0/host-primitives/native-artifact-contract.json",
      "sha256": "c5db2f4de55d3a5010cab653d9fe430862722fbd2f815dbc32c1a0fe46d92afb",
      "role": "supporting_evidence",
      "provenanceClass": "source_snapshot"
    },
    {
      "sourceId": "P0.W5.COMMAND_CATALOG",
      "path": "docs/research/hosted-web/phase-0/recovery-events/command-catalog.json",
      "sha256": "a40fd876f0a9ffc63e5932985c969ab867411716a48718586abf1552a35780ff",
      "role": "supporting_evidence",
      "provenanceClass": "source_snapshot"
    },
    {
      "sourceId": "P0.W5.EFFECT_RECOVERY",
      "path": "docs/research/hosted-web/phase-0/recovery-events/effect-recovery-matrix.json",
      "sha256": "c7166ca1ac43f72591fd1c56221dd3f2b6ffe8bebdbdca2b9fb89288874a79bc",
      "role": "supporting_evidence",
      "provenanceClass": "source_snapshot"
    },
    {
      "sourceId": "P0.W5.EVENT_CURSORS",
      "path": "docs/research/hosted-web/phase-0/recovery-events/event-cursor-inventory.json",
      "sha256": "2e296692f0415c3b82f3ce15cf1683bbd0aee846d2b571a5dff31bff406ddc15",
      "role": "supporting_evidence",
      "provenanceClass": "source_snapshot"
    },
    {
      "sourceId": "P0.W6.AUTH_ARTIFACT_EVIDENCE",
      "path": "docs/research/hosted-web/phase-0/auth-artifacts/evidence.json",
      "sha256": "082f9deced2bf21b5b15c14f9f8f786198e61eceb52b9007605949f45ebb503a",
      "role": "supporting_evidence",
      "provenanceClass": "target_candidate"
    },
    {
      "sourceId": "P0.W6.ARTIFACT_MANIFEST",
      "path": "docs/research/hosted-web/phase-0/auth-artifacts/proposed-hosted-artifact-manifest.json",
      "sha256": "8903c40cf3761996f5fc732e4d54e0803e2ff6c2eed32f7cbff1befcd7f65f73",
      "role": "supporting_evidence",
      "provenanceClass": "target_candidate"
    }
  ],
  "buckets": [
    {
      "bucketId": "EST-CONTRACTS",
      "title": "Shared contracts, feature skeletons, capability/route and architecture gates",
      "confidence": {
        "baseline": {
          "rating": "high",
          "sourceId": "P0.BASELINE_ESTIMATE"
        },
        "reconciled": {
          "rating": "high"
        },
        "changed": false,
        "reason": "W1 preserves the parent contract scope and supplies direct parity evidence without changing the range."
      },
      "estimateStatus": "evidence_reconciled",
      "allocationKeys": [
        "architecture-gates",
        "capability-route-contracts",